{
  "schema_version": 1,
  "profile_id": "mastertool-x-4.1.0.11-tmf-v1-io-v1",
  "product": "MasterTool X",
  "product_version": "4.1.0.11",
  "project": {
    "file_name": "TemplateExemplo v1.project",
    "sha256": "596625796e4efd54d3cc2d6286e858b683f0f58de66ab9a36eed532dd1d815f5",
    "size_bytes": 503040,
    "classification": "projeto sintético com controlador NX3008 e cartões de I/O configurados"
  },
  "structure": {
    "root_count": 3,
    "node_count": 42,
    "tree_sha256": "162d4fd747532bc0d9a6f22dc12eeaabcf59397ec4210e6787f68f1edf89f647",
    "tree_sha256_scope": "Árvore inteira varrida por probes/21, SEM distinguir objeto transiente — o scanner reaproveitado não lê `is_transient_object` por nó. NÃO é o mesmo escopo do `persistent_tree_sha256` de `template_registry`, que cobre um nível de filhos diretos: os dois números não são comparáveis entre si.",
    "unclassified_node_count": 13
  },
  "application_selector": {
    "name": "Application",
    "type_guid": "639b491f-5557-464c-af91-1471bac9f549",
    "expected_cardinality": 1
  },
  "compiler_version": {
    "status": "measured",
    "value": "3.5.18.50",
    "source": "run-012, leitura read-only de project settings (probes/36)"
  },
  "libraries": {
    "status": "measured",
    "value": {
      "count": 17,
      "confirmation_routes": 2
    },
    "source": "run-016, inventário conferido por duas rotas independentes (probes/41)"
  },
  "device_inventory": {
    "status": "unresolved",
    "value": null,
    "source": "R0b, varredura documental do que existe medido",
    "reason": "Nenhuma run mediu o inventário de dispositivos DESTE arquivo. `tools/build_device_inventory.py` existe e a base tem cartões de I/O configurados, mas não há artefato medido citável amarrado a este sha256 — e o hash de um inventário que ninguém computou seria invenção."
  },
  "library_lock": {
    "status": "unresolved",
    "value": null,
    "source": "docs/CURRENT_STATUS.md §4, dívida nomeada",
    "reason": "As 17 bibliotecas são placeholder: nenhum build fixa para que versão elas resolvem. Sem versão resolvida não existe hash de trava a computar, e um hash sobre nomes sem versão daria a impressão de travar o que não está travado."
  },
  "capability_qualification": {
    "status": "measured",
    "runs": [
      "R1-N10/run-001",
      "R1-N10/run-002",
      "R1-N10/run-003",
      "R1-N10/run-004",
      "R1-N10/run-005",
      "R1-N10/run-006",
      "R1-N10/run-007",
      "R1-N10/run-008",
      "R1-N10/run-009",
      "R1-N10/run-010",
      "R1-TASK-N10/run-001",
      "R1-TASK-N10/run-002",
      "R1-TASK-N10/run-003",
      "R1-TASK-N10/run-004",
      "R1-TASK-N10/run-005",
      "R1-TASK-N10/run-006",
      "R1-TASK-N10/run-007",
      "R1-TASK-N10/run-008",
      "R1-TASK-N10/run-009",
      "R1-TASK-N10/run-010",
      "W10-N10/run-001",
      "W10-N10/run-002",
      "W10-N10/run-003",
      "W10-N10/run-004",
      "W10-N10/run-005",
      "W10-N10/run-006",
      "W10-N10/run-007",
      "W10-N10/run-008",
      "W10-N10/run-009",
      "W10-N10/run-010"
    ],
    "reason": null,
    "capabilities": [
      {
        "operation": "create_gvl",
        "maturity": "repeatable",
        "runs": [
          "R1-N10/run-001",
          "R1-N10/run-002",
          "R1-N10/run-003",
          "R1-N10/run-004",
          "R1-N10/run-005",
          "R1-N10/run-006",
          "R1-N10/run-007",
          "R1-N10/run-008",
          "R1-N10/run-009",
          "R1-N10/run-010"
        ],
        "document": "docs/50-qualificacao-r1-n10.md"
      },
      {
        "operation": "create_program",
        "maturity": "repeatable",
        "runs": [
          "R1-N10/run-001",
          "R1-N10/run-002",
          "R1-N10/run-003",
          "R1-N10/run-004",
          "R1-N10/run-005",
          "R1-N10/run-006",
          "R1-N10/run-007",
          "R1-N10/run-008",
          "R1-N10/run-009",
          "R1-N10/run-010"
        ],
        "document": "docs/50-qualificacao-r1-n10.md"
      },
      {
        "operation": "create_function",
        "maturity": "repeatable",
        "runs": [
          "R1-N10/run-001",
          "R1-N10/run-002",
          "R1-N10/run-003",
          "R1-N10/run-004",
          "R1-N10/run-005",
          "R1-N10/run-006",
          "R1-N10/run-007",
          "R1-N10/run-008",
          "R1-N10/run-009",
          "R1-N10/run-010"
        ],
        "document": "docs/50-qualificacao-r1-n10.md"
      },
      {
        "operation": "create_function_block",
        "maturity": "repeatable",
        "runs": [
          "R1-N10/run-001",
          "R1-N10/run-002",
          "R1-N10/run-003",
          "R1-N10/run-004",
          "R1-N10/run-005",
          "R1-N10/run-006",
          "R1-N10/run-007",
          "R1-N10/run-008",
          "R1-N10/run-009",
          "R1-N10/run-010"
        ],
        "document": "docs/50-qualificacao-r1-n10.md"
      },
      {
        "operation": "create_dut",
        "maturity": "repeatable",
        "runs": [
          "R1-N10/run-001",
          "R1-N10/run-002",
          "R1-N10/run-003",
          "R1-N10/run-004",
          "R1-N10/run-005",
          "R1-N10/run-006",
          "R1-N10/run-007",
          "R1-N10/run-008",
          "R1-N10/run-009",
          "R1-N10/run-010"
        ],
        "document": "docs/50-qualificacao-r1-n10.md"
      },
      {
        "operation": "create_program_call",
        "maturity": "repeatable",
        "runs": [
          "R1-N10/run-001",
          "R1-N10/run-002",
          "R1-N10/run-003",
          "R1-N10/run-004",
          "R1-N10/run-005",
          "R1-N10/run-006",
          "R1-N10/run-007",
          "R1-N10/run-008",
          "R1-N10/run-009",
          "R1-N10/run-010"
        ],
        "document": "docs/50-qualificacao-r1-n10.md"
      },
      {
        "operation": "replace",
        "maturity": "repeatable",
        "runs": [
          "R1-N10/run-001",
          "R1-N10/run-002",
          "R1-N10/run-003",
          "R1-N10/run-004",
          "R1-N10/run-005",
          "R1-N10/run-006",
          "R1-N10/run-007",
          "R1-N10/run-008",
          "R1-N10/run-009",
          "R1-N10/run-010",
          "W10-N10/run-001",
          "W10-N10/run-002",
          "W10-N10/run-003",
          "W10-N10/run-004",
          "W10-N10/run-005",
          "W10-N10/run-006",
          "W10-N10/run-007",
          "W10-N10/run-008",
          "W10-N10/run-009",
          "W10-N10/run-010"
        ],
        "document": "docs/50-qualificacao-r1-n10.md; docs/53-qualificacao-w10-n10.md (alvo PREEXISTENTE)"
      },
      {
        "operation": "save_as",
        "maturity": "repeatable",
        "runs": [
          "R1-N10/run-001",
          "R1-N10/run-002",
          "R1-N10/run-003",
          "R1-N10/run-004",
          "R1-N10/run-005",
          "R1-N10/run-006",
          "R1-N10/run-007",
          "R1-N10/run-008",
          "R1-N10/run-009",
          "R1-N10/run-010"
        ],
        "document": "docs/50-qualificacao-r1-n10.md"
      },
      {
        "operation": "reopen",
        "maturity": "repeatable",
        "runs": [
          "R1-N10/run-001",
          "R1-N10/run-002",
          "R1-N10/run-003",
          "R1-N10/run-004",
          "R1-N10/run-005",
          "R1-N10/run-006",
          "R1-N10/run-007",
          "R1-N10/run-008",
          "R1-N10/run-009",
          "R1-N10/run-010"
        ],
        "document": "docs/50-qualificacao-r1-n10.md"
      },
      {
        "operation": "build",
        "maturity": "repeatable",
        "runs": [
          "R1-N10/run-001",
          "R1-N10/run-002",
          "R1-N10/run-003",
          "R1-N10/run-004",
          "R1-N10/run-005",
          "R1-N10/run-006",
          "R1-N10/run-007",
          "R1-N10/run-008",
          "R1-N10/run-009",
          "R1-N10/run-010"
        ],
        "document": "docs/50-qualificacao-r1-n10.md"
      },
      {
        "operation": "verify",
        "maturity": "repeatable",
        "runs": [
          "R1-N10/run-001",
          "R1-N10/run-002",
          "R1-N10/run-003",
          "R1-N10/run-004",
          "R1-N10/run-005",
          "R1-N10/run-006",
          "R1-N10/run-007",
          "R1-N10/run-008",
          "R1-N10/run-009",
          "R1-N10/run-010"
        ],
        "document": "docs/50-qualificacao-r1-n10.md"
      },
      {
        "operation": "create_task",
        "maturity": "repeatable",
        "runs": [
          "R1-TASK-N10/run-001",
          "R1-TASK-N10/run-002",
          "R1-TASK-N10/run-003",
          "R1-TASK-N10/run-004",
          "R1-TASK-N10/run-005",
          "R1-TASK-N10/run-006",
          "R1-TASK-N10/run-007",
          "R1-TASK-N10/run-008",
          "R1-TASK-N10/run-009",
          "R1-TASK-N10/run-010"
        ],
        "document": "docs/51-qualificacao-r1-task-n10.md"
      },
      {
        "operation": "bind_program_to_task",
        "maturity": "repeatable",
        "runs": [
          "R1-TASK-N10/run-001",
          "R1-TASK-N10/run-002",
          "R1-TASK-N10/run-003",
          "R1-TASK-N10/run-004",
          "R1-TASK-N10/run-005",
          "R1-TASK-N10/run-006",
          "R1-TASK-N10/run-007",
          "R1-TASK-N10/run-008",
          "R1-TASK-N10/run-009",
          "R1-TASK-N10/run-010"
        ],
        "document": "docs/51-qualificacao-r1-task-n10.md"
      },
      {
        "operation": "configure_task",
        "maturity": "repeatable",
        "runs": [
          "R1-TASK-N10/run-001",
          "R1-TASK-N10/run-002",
          "R1-TASK-N10/run-003",
          "R1-TASK-N10/run-004",
          "R1-TASK-N10/run-005",
          "R1-TASK-N10/run-006",
          "R1-TASK-N10/run-007",
          "R1-TASK-N10/run-008",
          "R1-TASK-N10/run-009",
          "R1-TASK-N10/run-010"
        ],
        "document": "docs/51-qualificacao-r1-task-n10.md"
      }
    ]
  },
  "provenance": [
    {
      "field": "project.sha256",